{
  "id": "WANDS_01",
  "title": "Spark of IGNI",
  "suit": "wands",
  "rank": 1,
  "elemental_ruler": "Mars in Aries",
  "chakra": "root",
  "hexagram": 1,
  "archetype": "ignition_keeper",
  "visionary_anchor": "Hypatia of Alexandria (d. 415 CE)",
  "martyr_resonance": true,
  "execution_context": "Mob violence for teaching mathematics and astronomy to women",
  "living_voice": "Light begins where fear ends. My astrolabe calculated infinity.",
  "ritual_function": "Ignites courage to begin forbidden knowledge",
  "nd_safe_healing": "Transforms fear of learning into sacred curiosity",
  "choice_vectors": [
    {
      "prompt": "Study her lost theorems in the Library's ashes.",
      "consequence": { "unlock": "WANDS_02", "trait": "forbidden_mathematics", "wisdom": 2 }
    },
    {
      "prompt": "Hide the knowledge to keep it safe.",
      "consequence": { "stress": 1, "wisdom": -1, "unlock": "CUPS_04" }
    },
    {
      "prompt": "Teach others what she died protecting.",
      "consequence": { "unlock": "MA05", "trait": "hierophant_courage", "courage": 3 }
    }
  ],
  "lattice": { "x": 144, "y": 99 },
  "legacy_focus": "First woman mathematician, inventor of astrolabe, preserved Greek learning",
  "codex_node": 1,
  "trauma_accommodations": ["content_warning", "agency_emphasis", "healing_focus"]
}